{
  "profile": "coordinate_hud_tbc243_v1",
  "profile_version": "0.3.0",
  "target_profile": "tbc_243_lab",
  "client_build": "2.4.3.8606",
  "protocol_version": 3,
  "magic": 165,
  "grid_columns": 16,
  "grid_rows": 7,
  "cell_pitch_px": 5,
  "fiducial_dx_px": 92,
  "fiducial_dy_px": 34,
  "first_cell_dx_px": 7,
  "first_cell_dy_px": 1,
  "search_height_fraction": 0.35,
  "search_width_fraction": 0.5,
  "marker_high_threshold": 200,
  "marker_low_threshold": 80,
  "bit_luminance_threshold": 127,
  "maximum_fiducial_error_px": 12,
  "maximum_marker_candidates_per_color": 12,
  "maximum_marker_foreground_pixels": 65536,
  "maximum_marker_component_pixels": 4096,
  "maximum_marker_components_per_color": 256,
  "maximum_frame_pixels": 8847360,
  "capture_deadline_ms": 250,
  "detector_deadline_ms": 500,
  "freshness_limit_ms": 600,
  "calibration_state": "synthetic_verified",
  "execution_authority": false
}
